news_id,url,title,text,topic,tags,published_at,language
88994,https://lenta.ru/news/2004/03/09/weapon/,Задержаны пятеро подозреваемых в краже оружия со склада во Владивостоке,"Пять военнослужащих задержаны по делу о хищении оружия со склада одной из частей внутренних войск МВД России во Владивостоке. Как подтвердили информационному агентству ""Интерфакс"" в Генпрокуратуре, уголовное дело по факту пропажи оружия со склада было возбуждено военной прокуратурой Дальневосточного военного округа по статье 226 Уголовного Кодекса Российской Федерации - ""хищение оружия"". Как сообщается на сайте Генпрокуратуры, установлена группа военнослужащих-призывников, причастных к хищению оружия. Их фамилии в интересах следствия не разглашаются. Задержанных допрашивают, одновременно принимаются меры по розыску похищенного оружия и возвращению его в часть. Кроме того, как подчеркивается в сообщении Генпрокуратуры, в частях округа внутренних войск проводится проверка исполнения командованием законодательства, регламентирующего правила хранения и учета оружия и боеприпасов. Ранее сообщалось, что из конвойной части Минюста России, дислоцированной во Владивостоке, было похищено 79 единиц автоматического оружия. Утверждалось, что были украдены, в частности, 17 пулеметов, 37 автоматов Калашникова калибра 5,45 миллиметра, 24 автомата Калашникова калибра 7,62 миллиметра и одна снайперская винтовка СВД. По версии следствия, оружие вытащили через дыру, проделанную в потолке склада - и не за один раз. Несколькими часами позже информационное агентство ""Дейта.Ru"" сообщило, что во Владивостоке были задержаны трое военнослужащих, подозреваемых в хищении оружия. Сообщалось и о уголовном деле, которое возбудила прокуратура Дальневосточного военного округа.",Россия,Все,2004-03-09,ru
88999,https://lenta.ru/news/2004/03/09/kadyrov/,Ахмад Кадыров: Масхадов психологически сломлен,"Решение министра обороны Ичкерии Магомеда Хамбиева сдаться властям нанесло сильный психологический удар по Аслану Масхадову. Об этом агентству ""Интерфакс"" заявил президент Чечни Ахмад Кадыров. По его словам, Масхадов ""до сих пор пытался представлять себя в качестве президента, у которого якобы в подчинении имеются министры и, в частности, министр обороны"". Как считает Кадыров, теперь у Масхадова остается только три выхода - покинуть Чечню, добровольно сдаться или быть убитым в результате операции федеральных сил. По словам президента Чечни, Масхадов наверняка попытается бежать. Кадыров отказался комментировать сообщения о том, что с Масхадовым ведутся переговоры о его добровольной сдаче. Вместе с тем глава чеченской администрации не исключил, что Масхадов ""в той или иной форме попытается попросить амнистию"". Высокопоставленный источник агентства РИА ""Новости"" в Министерстве обороны РФ не исключил, что Масхадов скрывается за пределами Чечни. Вместе с тем источник заявил, что Масхадов и полевой командир Шамиль Басаев не покидали территории России. Магомед Хамбиев сдался властям в воскресенье. По сведениям газеты ""Коммерсант"", он сложил оружие после того, как служба безопасности президента Чечни совместно со спецназом и ОМОНом провела операцию по захвату боевиков из отряда Хамбиева, а затем задержала его родственников. Федеральные источники утверждают, что Хамбиева уговорили сдаться старейшины его тейпа. Чеченская администрация пообещала ходатайствовать об амнистии Хамбиева, поскольку он не поддерживал ваххабитов и не участвовал в похищениях людей. Ожидается, что специальная проверка займет около 10 дней. Заместитель прокурора Чечни Александр Никитин сообщил агентству ИТАР-ТАСС, что пока сотрудники прокуратуры не обнаружили доказательств причастности Хамбиева к тяжким преступлениям.",Россия,Все,2004-03-09,ru
89003,https://lenta.ru/news/2004/03/09/group/,"МВД: Группировки, взявшей ответственность за теракт в метро, в Чечне нет","Специальная проверка МВД Чечни показала, что в республике нет группировки ""Мюриды Газавата"" или ""Газотон Мурдаш"" (""Воины священной войны""), которая взяла на себя ответственность за теракт в московском метро 6 февраля. ""Информация о некоей группировке ""Мюриды Газавата"", которая взяла на себя ответственность за теракт в метро, по всей видимости, пропагандистская утка боевиков. В Чечне такой группировки нет"", - приводит слова пресс-секретаря МВД Чечни Руслана Ацаева интернет-издание ""Газета.Ru"". Он заявил, что чеченские милиционеры провели по этому поводу ""конкретную проверку"", собрали информацию из всех районов республики, провели беседы с жителями, но никаких следов существования такой группировки не обнаружили. Секретарю Совета безопасности Чечни Руднику Дудаеву также ничего неизвестно о группировке ""Мюриды газавата"". ""В Чечне такой группировки нет. О ее существовании мне ничего не известно"", - сказал Дудаев 6 марта. Он предположил, что это ""попытка боевиков показать своим зарубежным спонсорам свою активность"". Сообщения о том, что ранее неизвестная вооруженная группировка ""Мюриды Газавата"" взяла на себя ответственность за взрыв в поезде метро между станциями ""Автозаводская"" и ""Павелецкая"" 6 февраля, появилась в ряде российских интернет-СМИ 1 марта. Источником данной информации явился сайт ""чеченского независимого интернет-агентства"" ""Кавказ-центр"". По заявлению ""Центра"", в его редакцию с анонимного e-mail - адреса пришло несколько писем, в которых лидер группировки, представившийся как Лом-Али Чеченский, заявлял о причастности организации к теракту на Замоскворецкой линии. Первое письмо было получено еще 8 февраля, позже, 29 февраля, ночью некто, представившийся Лом-Али Чеченским, позвонил в редакцию со спутникового телефона, подтвердив содержавшуюся в письмах информацию. ""Кавказ-центр"" имеет устойчивую репутацию ресурса, на страницах которого регулярно появляются сообщения о крупных победах ""моджахедов"" над ""оккупантами"". В первые годы второй чеченской войны российские власти пытались запретить отечественным СМИ использовать информацию оттуда и даже ссылаться на данный ресурс. Позже усилиями российских спецслужб и дипломатов сайт неоднократно закрывался, чтобы через месяц начать работать по другому адресу. В результате теракта в московском метро 6 февраля погибли 40 человек, пострадали более 120.",Россия,Все,2004-03-09,ru
89011,https://lenta.ru/news/2004/03/09/destroy/,Иракские ученые рассказали об уничтоженном арсенале Саддама,"Бывший президент Ирака Саддам Хусейн уничтожил все запасы оружия массового поражения и оборудование для его производства летом 1991 года. Об этом объявили руководители ядерной программы Ирака Номан Саад Эддин аль-Ноаими (Noman Saad Eddin al-Noaimi) и Джафар Диа Джафар (Jafar Dhia Jafar) в совместном докладе, передает агентство Associated Press. Ученые утверждают, что с 1991 года иракское правительство не пыталось возобновить работы по созданию запрещенных вооружений. Вместе с тем Джафар признал, что в 1991 году Саддам Хусейн пытался скрыть запасы оружия и оборудование от международных наблюдателей, прибывших в Ирак. По словам Джафара, через несколько недель от попыток помешать проверкам пришлось отказаться, поскольку инспекторы действовали очень быстро и активно использовали воздушную разведку, а иракское правительство просто не успевало спрятать громоздкое оборудование. Как рассказали ученые, уничтожение арсеналов проходило под контролем отрядов спецназначения Республиканской гвардии Ирака. При этом правительство не вело тщательного учета уничтоженного оружия. По словам Джафара, позднее предпринимались попытки подготовить полную документацию, однако эта работа осталась незавершенной. Джафар заявил, что накануне вторжения американцев в Ирак инспекторы Международного агентства по атомной энергии (МАГАТЭ) уже знали, что в Ираке нет запрещенного оружия, однако не убедили в этом американскую администрацию. Представитель МАГАТЭ опроверг слова Джафара, заявив, что к началу войны агентство не завершило проверки в Ираке и не пришло к окончательным выводам. Джафар потребовал от ООН провести соответствующее расследование. После оккупации Ирака американские эксперты не смогли обнаружить в стране никаких следов оружия массового поражения. В январе этого года помощник президента США по национальной безопасности Кондолизза Райс признала, что сведения американской разведки о запрещенном оружии Саддама Хусейна могли быть недостоверными. Американская администрация начала проверку работы разведки с целью выяснить, какие ошибки были допущены. Джафар Диа Джафар бежал в Сирию после вторжения американской армии в Ирак, но вскоре сдался США. В понедельник впервые после войны он выступил публично, посетив конференцию в Бейруте, посвященную последствиям военной операции в Ираке.",Мир,Все,2004-03-09,ru
89012,https://lenta.ru/news/2004/03/09/government/,Путин объявил состав нового правительства,"Президент РФ Владимир Путин объявил во вторник о назначениях на ключевые посты в новом правительстве, возглавляемом Михаилом Фрадковым, передает агенство ""Интерфакс"". Первым вице-премьером стал вице-спикер Госдумы Александр Жуков. Должность министра иностранных дел получил представитель РФ при ООН Сергей Лавров. МВД возглавил Рашид Нургалиев, исполняющий обязанности министра внутренних дел с момента отставки Бориса Грызлова, который после парламентских выборов занял должность председателя Госдумы. Министром экономического развития и торговли назначен Герман Греф, министром по чрезвычайным ситуациям - Сергей Шойгу, министром обороны - Сергей Иванов, министром финансов - Алексей Кудрин, министром сельского хозяйства и рыболовства - Алексей Гордеев, министром здравоохранения и социального развития - Михаил Зурабов, министром образования и науки - Андрей Фурсенко, министром культуры и информации - Александр Соколов, министром природных ресурсов - Юрий Трутнев, министром юстиции - Юрий Чайка, министром транспорта - Юрий Левитин. Бывший вице-премьер Виктор Христенко занял пост министра промышленности и энергетики. Бывший министр иностранных дел Игорь Иванов назначен на должность секретаря Совета безопасности России. Руководителем аппарата правительства назначен Дмитрий Козак, ранее занимавший должность заместителя главы президентской администрации. В новой структуре правительства будет только один вице-премьер и 14 министерств вместо 23. Указом президента о системе и структуре федеральных органов исполнительной власти упразднены Министерство по антимонопольной политике, Минатом, Минпечати, Минздрав, Минимущества, Минкультуры, Минобразования, Минпромнауки, Министерство путей сообщения, Минсвязи и информатизации, Минтранс, Минтруда и социального развития, Минэнерго. Кроме того, прекратили существование госкомитет по рыболовству и госкомитет по физкультуре и спорту, федеральная комиссия по рынку ценных бумаг и четыре федеральные службы - служба геодезии и картографии, служба по гидрометеорологии и мониторингу окружающей среды, служба железнодорожных войск, служба по финансовому оздоровлению и банкротству. Также упразднены агентства по боеприпасам, по обычным вооружением, по системам управления и по судостроению. Как заявил Владимир Путин на совещении в Кремле, все назначенные во вторник министры сохранят свои портфели, если он будет переизбран на второй срок 14 марта. По словам Путина, предусмотренная конституцией процедура назначения нового правительства после выборов президента в случае его победы будет ""чисто формальным актом"", передает агентство ИТАР-ТАСС. Путин пообещал, что в новом правительстве значительно сократится число промежуточных звеньев при принятии управленческих решений. Он также сообщил об изменении роли аппарата кабинета министров, который ""из параллельного теневого правительства должен превратиться в эффективный и современный инструмент администрирования"". Министр сельского хозяйства Алексей Гордеев сообщил агентству РИА ""Новости"", что первое заседание нового правительства пройдет в четверг, 11 марта. Планируется, что на заседании пойдет речь о состоянии жилищно-коммунального хозяйства.",Россия,Все,2004-03-09,ru
89015,https://lenta.ru/news/2004/03/09/litva/,"""Дело Паксаса"" может повредить европейским перспективам Литвы","Скандал вокруг процедуры импичмента в отношении президента Литвы Роландаса Паксоса может повредить перспективам вступления балтийской республики в НАТО и Евросоюз, считает британское издание Independent. В то время как литовским законодателям предстоит ратифицировать в ближайшие недели соглашение о присоединении в Североатлантическому альянсу, в понедельник парламент начал слушания в рамках обвинительного процесса против главы государства. Паксас был избран президентом Литвы 5 января 2003 года. В конце октября того же года Департамент госбезопасности Литвы информировал парламент о неких связях главы государства и его ближайшего окружения с международной преступностью. В декабре парламентская комиссия Литвы, расследующая обвинения в отношении Паксаса, констатировала, что его окружение связано с лицами и структурами сомнительной репутации, в числе которых были названы финансовый спонсор президента Юрий Борисов и российская компания Almax. Расследование завершилось 19 февраля. Комиссия, в частности, признала, что Паксас принял на себя обязательства, несовместимые с интересами государства, не обеспечил охрану гостайны и своими действиями ""дискредитировал авторитет власти и институт президента"". Сам Паксас отрицает все предъявленные ему обвинения и отказывается добровольно уйти в отставку.",Мир,Все,2004-03-09,ru
