news_id,url,title,text,topic,tags,published_at,language
89226,https://lenta.ru/news/2004/03/12/pension/,С апреля пенсии в России вырастут на 121 рубль,"С апреля 2004 года пенсии в России будут увеличены в среднем на 121 рубль. Об этом заявил в пятницу министр здравоохранения и соцразвития РФ Михаил Зурабов на встрече с президентом Владимиром Путиным, передает РИА ""Новости"". Министр уточнил, что названная цифра является средним показателем по всем категориям пенсионеров, в то время как пенсия по старости вырастет на 135 рублей. По его словам, соответствующее постановление согласовано со всеми ведомствами и может быть принято правительством уже на следующей неделе. Зурабов отметил, что апрельская прибавка к пенсии не будет последней в нынешнем году. ""Мы как бы отдаем долги за прошлый год, и это повышение - доиндексация по итогам работы страны, правительства в прошлом году"", - сказал министр. Владимир Путин на встрече сообщил, что в пятницу направит в Госдуму проект закона об улучшении пенсионного обеспечения инвалидов, получивших травмы во время войны. Он поблагодарил Зурабова за то, что его поручение подготовить этот документ было оперативно исполнено.",Экономика,Все,2004-03-12,ru
89227,https://lenta.ru/news/2004/03/12/account/,"Басманный суд санкционировал арест счетов совладельцев ""ЮКОСа""","Басманный суд Москвы удовлетворил ходатайство Генпрокуратуры России об аресте швейцарских банковских счетов россиян, фигурирующих в так называемом деле ""ЮКОСа"", передает ""Интерфакс"". Санкция распространяется, в частности, на счета бывшего главы ""ЮКОСа"" Михаила Ходорковского, а также Платона Лебедева, Леонида Невзлина, Владимира Дубова, Михаила Брудно и Александра Темирко. Генпрокуратура утверждает, что по ее запросу швейцарская прокуратура уже заблокировала их счета в пяти банках на общую сумму около 5 миллиардов долларов. Как заявили РИА ""Новости"" в Управлении информации и общественных связей Генпрокуратуры, сейчас ""решаются вопросы, связанные с привлечением к уголовной ответственности всех лиц, чьи счета заблокированы, за отмывание преступно нажитых средств на территории Швейцарии"". Сам Михаил Ходорковский опровергает информацию об аресте 5 миллиардов долларов. По его словам, в действительности общая сумма финансовых средств, находящаяся в распоряжении структур группы МЕНАТЕП, составляет приблизительно 4,5 миллиарда долларов. ""Указанные финансовые средства, принадлежащие структурам группы МЕНАТЕП, не заблокированы и не находятся под арестом. Иных крупных денежных средств в распоряжении группы нет"", - говорится в заявлении экс-главы ЮКОСа"", размещенном на сайте фонда ""Открытая Россия"". ""Оставляю на совести представителей Генеральной прокуратуры абсолютно ложное утверждение, что я и мои коллеги украли у государства 5 миллиардов долларов"", - подчеркивает Ходорковский.",Россия,Все,2004-03-12,ru
89231,https://lenta.ru/news/2004/03/12/abashidze/,"Абашидзе раскрыл план ""революции роз"" в Аджарии","В середине марта грузинские власти попытаются повторить в Аджарии так называемую ""революцию роз"", утверждает лидер автономной республики Аслан Абашидзе. Он заявил ""Интерфаксу"", что в этих условиях Россия ""просто обязана защитить Аджарию"". Абашидзе располагает сведениями о том, что руководство Грузии намерено ""собрать со всех регионов 100 тысяч человек и направить их 14-15 марта маршем на Батуми"". ""Впереди поставят женщин, и это будет как бы человеческий щит, если, конечно, будет противостояние. А потом обвинят власти Аджарии в жесткости. Таков их план"", - сказал Абашидзе. По его словам, ""десятки тысяч людей не приедут сюда, чтобы поздравить нас, скажем, с каким-то знаменательным днем. В календаре в эти дни нет праздников. Они приедут, чтобы сделать то же самое, что сделали в Тбилиси"". В данном случае Абашидзе имеет в виду события ноября прошлого года, когда под нажимом оппозиции Эдуард Шеварднадзе покинул пост президента Грузии. ""Я уверяю, здесь это не получится"", - заявил глава аавтономии. Он подчеркнул, что жители Аджарии ""готовы защитить Конституцию, конституционный строй и ни на минуту не дрогнут"". Абашидзе убежден, что организаторами этой акции являются центральные власти Грузии. ""Конечно это руководство страны, первые руководители. Без президента такое не делается"", - цитирует ""Интерфакс"" слова аджарского лидера. Тем временем грузинский президент Михаил Саакашвили заявил в пятницу, что ""определенные силы пытаются отвлечь внимание руководства Грузии от проблем в Аджарии, но этого не произойдет"".",Россия,Все,2004-03-12,ru
89234,https://lenta.ru/news/2004/03/12/khodorkovsky/,Ходорковский оставил 5 миллиардов долларов на совести прокуратуры,"Общая сумма финансовых средств, находящаяся в распоряжении структур МЕНАТЕП, составляет приблизительно 4,5 миллиарда долларов США, и заявление Генеральной прокуратуры России об аресте личных счетов акционеров группы на сумму около 5 миллиардов долларов США является ""абсолютно ложным"". Об этом заявил глава фонда ""Открытая Россия"" и бывший руководитель нефтяной компании ""ЮКОС"" Михаил Ходорковский. ""Оставляю на совести представителей Генеральной прокуратуры абсолютно ложное утверждение, что я и мои коллеги украли у государства 5 миллиардов долларов. И что эти средства якобы заблокированы на наших личных счетах в Швейцарии. В действительности, общая сумма финансовых средств, находящаяся в распоряжении структур группы МЕНАТЕП, составляет приблизительно 4,5 миллиарда долларов США. Эти деньги имеют абсолютно прозрачный источник происхождения – дивиденды по акциям и выручку от продажи небольших пакетов акций портфельным инвесторам. Происхождение и размер этих денежных средств подтверждены ежегодным внешним аудитом. Данные средства прямо или через специализированные учреждения вложены в основном в российские активы или предоставлены в распоряжение благотворительных организаций. Указанные финансовые средства, принадлежащие структурам группы МЕНАТЕП, не заблокированы и не находятся под арестом. Иных крупных денежных средств в распоряжении группы нет"", - говорится в заявлении Ходорковского, размещенном на сайте фонда ""Открытая Россия"".",Россия,Все,2004-03-12,ru
89237,https://lenta.ru/news/2004/03/12/funds/,Кандидаты в президенты потратили 200 миллионов рублей,"В пятницу Центризбирком РФ обнародовал сведения о поступлении и расходовании средств избирательных фондов кандидатов в президенты РФ. По данным на 10 марта, на счетах избирательных фондов всех кандидатов находилось 237 миллионов 223 тысячи рублей. Расходы составили 203 миллиона 693 тысячи рублей. Больше всех денег потратила Ирина Хакамада. Ее расходы на предвыборную кампанию составили 83 миллиона 508 тысяч рублей, притом, что за период с 27 февраля по 10 марта сумма, которая находилась на ее счетах в Сбербанке увеличилась более чем вдвое - с 40414 тысяч до 96214 тысяч рублей. На втором месте по количеству денег на счету идет избирательный фонд Сергея Миронова. 10 марта у него было 52149 тысяч рублей, а расходы составили 47146 тысяч. В избирательном фонде Владимира Путина 10 марта было 42592 тысячи рублей, а израсходовал он 36104 тысячи. На счетах Олега Малышкина было аккумулировано 25 миллионов рублей, его расходы составили 20 миллионов 87 тысяч рублей. К 10 марта фонд Сергея Глазьева располагал 11433 тысячами рублей, а израсходовано из него было 11378 тысяч. Последним в списке идет избирательный фонд Николая Харитонова, на счетах которого было 9 миллионов 834 тысячи рублей, а расходы составили 5468 тысяч.",Россия,Все,2004-03-12,ru
89256,https://lenta.ru/news/2004/03/12/priest/,Священника-книгоборца арестовали сто грузинских спецназовцев,"Грузинский спецназ штурмом взял церковь в Глданском районе Тбилиси, в которой укрылся отлученный от церкви бывший православный священник Василий Мкалавишвили, сообщает РИА ""Новости"". В операции по аресту бывшего священника участвовали около ста бойцов грузинского МВД. Им противостояли сторонники Мкалавишвили, которые оказали спецназовцам активное сопротивление, забросав их камнями. В результате операции с обеих сторон пострадали примерно по 20 человек. В больницу доставлены трое пострадавших. Мкалавишвили доставлен в 5-й следственный изолятор департамента по исполнению наказаний министерства юстиции Грузии. 4 июня 2003 года суд Ваке-Сабурталинского района города Тбилиси вынес в отношении священника  постановление о трехмесячном предварительном заключении, однако Мкалавишвили до момента его ареста скрывался от правоохранительных органов. Мкалавишвили обвиняют в умышленном уничтожении имущества, принадлежащего баптистам, ""Свидетелям Иеговы"" и другим сектам. В марте 2001 года в пригороде Тбилиси Мкалавишвили со своими сторонниками сжег принадлежавшую им религиозную литературу.",Россия,Все,2004-03-12,ru
89259,https://lenta.ru/news/2004/03/12/shield/,США беззащитны перед северокорейскими ракетами,"Американская система противоракетной обороны, стоимостью в несколько миллиардов долларов, не сможет сдержать ракетный удар КНДР, сообщает Reuters. Выступая на заседании Конгресса США, директор независимой компании по оценке и испытаниям при Пентагоне Томи Кристи в ответ на вопрос, будет ли система в ее нынешнем виде работать в случае нападения КНДР, ответил отрицательно. Главной проблемой, по мнению Кристи, является то, что к моменту ее окончательного вода в строй, ПРО не будет испытана, и уверенности в ее боеспособности не может быть в принципе. Между тем, элементы ПРО, которая уже получила неофициальное название ""звездных войн"", уже размещаются на наземных базах и кораблях. Управление глобальной многоуровневой системой будет осуществляться со спутников. Первые ракеты будут введены в строй в конце 2004 года. Однако, как заявил выступавший на заседании сенатор из Мичигана Карл Левин (Carl Levin), деньги, выделенные на  проект, пойдут на ""сомнительную защиту от маловероятного удара ракет дальнего радиуса действия"". По данным Reuters, Джордж Буш попросил Конгресс выделить в 2005 финансовом году на противоракетнцую оборону страны 10,2 миллиарда долларов, что на 13 больше, чем в 2004, и значительно превышает финансирование любого другого военного проекта. По словам Левина, Пентагон нарушает основное правило, которое следует соблюдать во время принятия нового вида вооружения, - ""полетай до того как купить"". Томи Кристи не первый раз открыто заявляет о неэффективности системы ПРО. Так в конце января он сказал, что Министерство обороны определило слишком короткие сроки для создания ПРО и провело испытания в условиях, существенно отличающихся от реальных. По данным Кристи, до конца 2003 года Пентагон провел восемь испытаний ПРО, только пять из них закончились успешно - ракеты-перехватчики поразили условную цель. На этот год были запланированы лишь два запуска ракет, чего явно, по его мнению, недостаточно - даже если все запуски пройдут успешно, вопрос об эффективности ПРО не будет снят.",Мир,Все,2004-03-12,ru
89261,https://lenta.ru/news/2004/03/12/saakashvili/,"Михаил Саакашвили: священника-книгоборца арестовали, чтобы усилить православие","Президент Грузии Михаил Саакашвили, комментируя задержание бывшего священника Василия Мкалавишвили, заявил, что его задача как президента - усилить православие в стране и не допустить экстремизма и раздора в церкви, сообщает РИА ""Новости"". ""Моя первоочередная задача как президента страны и православного христианина - усилить православие в Грузии и не допустить экстремизма и раздора в церкви... От вредного иностранного влияния и экстремизма Грузию должно защитить грузинское государство, а не какой-то местный экстремист. Нигде не записано, что истинные христиане должны избивать людей крестами"", - заявил Саакашвили. ""Главная опасность, которая в Грузии угрожает православию - это самозванные экстремисты, которые, прикрываясь православием, пытаются вызвать раздор в грузинской церкви"", - подчеркнул президент. Бывший священник Василий Мкалавишвили, который объявил себя ""борцом за православие"", известен своим резко агрессивным отношением к сектам и нетрадиционным для Грузии конфессиям. В марте 2001 года в пригороде Тбилиси Мкалавишвили со своими сторонниками сжег религиозную литературу, принадлежавшую баптистам, ""Свидетелям Иеговы"" и другим сектам. 4 июня 2003 года суд Ваке-Сабурталинского района города Тбилиси вынес в отношении священника постановление о трехмесячном предварительном заключении, однако Мкалавишвили до момента его ареста скрывался от правоохранительных органов. В пятницу грузинский спецназ штурмом взял церковь в Глданском районе Тбилиси, в которой укрылся бывший священник. В операции по его аресту участвовали около ста бойцов грузинского МВД. Им противостояли сторонники Мкалавишвили, которые оказали спецназовцам активное сопротивление, забросав их камнями.В результате операции с обеих сторон пострадали примерно по 20 человек. В больницу доставлены трое пострадавших. Мкалавишвили доставлен в 5-й следственный изолятор департамента по исполнению наказаний министерства юстиции Грузии. Саакашвили также высказался по поводу недавнего инцидента в Хелвачаурском районе Аджарии, когда преступники, личности которых установить не удалось, жестоко избили журналиста грузинской телекомпании ""Рустави-2"" Вахтанга Комахидзе. Кроме того, в течение последних недель в республике избили представителей нескольких местных оппозиционных организаций ""Я, как президент Грузии, обязан заботиться о защите прав граждан всех регионов страны, независимо от их политических взглядов"", - заявил Саакашвили, и потребовал от властей Аджарии ""принятия конкретных мер по задержанию и наказанию этих лиц"".",Россия,Все,2004-03-12,ru
