news_id,url,title,text,topic,tags,published_at,language
88695,https://lenta.ru/news/2004/03/03/tax/,"Министерство по налогам и сборам обвинило ""Сибнефть"" в недоплате миллиарда долларов","Министерство РФ по налогам и сборам (МНС) обвинило нефтяную компанию ОАО ""Сибнефть"" в неуплате налогов на сумму в один миллиард долларов США за 2000 - 2001 годы, сообщает РИА ""Новости"". Пресс-секретарь ""Сибнефти"" Алексей Фирсов заявил, что компания уже получила соответствующие материалы от МНС. ""Мы можем сказать, что деятельность компании за этот промежуток времени проверялась неоднократно, и все проверки были легитимными"", - заявил он. Фирсов отметил, что ""компания и дальше намерена показывать МНС, что вся ее деятельность находится в рамках законодательства"". Как сообщается на сайте газеты ""Ведомости"" со ссылкой на источник в МНС, акт налоговой проверки в ""Сибнефти"" за 2000 - 2001 был направлен в компанию в конце февраля этого года. По словам источника, ""претензии к ""Сибнефти"" сходны с теми, что были ранее предъявлены ""ЮКОСу"". В частности, речь идет об уходе от уплаты региональных и местных налогов"". В декабре 2002 года Счетная палата обвинила ""Сибнефть"" в неуплате налогов в бюджет в 2001 году на сумму 10 миллиардов рублей. Однако тогда нефтяники пользовались законной схемой. Как выяснили аудиторы, практически все свое сырье компания продавала через трейдерские фирмы (сейчас они уже входят в состав компании), половина сотрудников которых были инвалидами. Соответствующие льготы были отменены лишь с 1 января 2002 года. Кроме того, ""Сибнефть"" пользовалась внутренними офшорами (Калмыкия, Чукотка), что позволяло платить налог на прибыль по ставке 5,5 процента. Материалы проверки были переданы в МВД. В октябре прошлого года президент ""Сибнефти"" Евгений Швидлер беседовал со следователями МВД в рамках дознания по делу о налоговых платежах компании. В ноябре 2003 года в МВД заявили, что не имеют претензий к Роману Абрамовичу, владеющему 80 процентами акций ""Сибнефти"". В мае 2001 года в отношении руководства компании ""Сибнефть"" Генпрокуратурой РФ были возбуждены уголовные дела по статье ""хищение путем мошенничества в крупных размерах"" (ст. 159-я ч. 3-я УК РФ). ""Сибнефть"" обвинили в неуплате налогов на добавленную стоимость на сумму от 12 до 14 миллионов рублей, а также в необоснованном получении льгот на налогообложение. Вскоре Генпрокуратура вынесла постановление о прекращении этих дел ""за отсутствием в действиях руководителей компании состава преступления"". Напомним, что в апреле 2003 года ""ЮКОС"" и ""Сибнефть"" совершили сделку, в результате которой ""ЮКОС"" стал владельцем 92 процентов акций компании. К октябрю совладельцы ""ЮКОСа"" заплатили три миллиарда долларов за 20 процентов акций ""Сибнефти"" и обменяли 26 процентов своих акций на оставшиеся 72 процента акций ""Сибнефти"". 3 февраля 2004 года ""ЮКОС"" и ""Сибнефть"" объявили о разделении компаний, однако этот процесс еще не был завершен. 29 декабря 2003 года руководству ""ЮКОСа"" был вручен акт налоговой проверки, в котором против компании было выдвинуто обвинение в неуплате налогов на общую сумму более 98 миллиардов рублей. Компанию обвинили в умышленных действиях по оформлению оборотов с нефтью и нефтепродуктами через организации, зарегистрированные в субъектах РФ и городах, где действуют дополнительные налоговые льготы.",Экономика,Все,2004-03-03,ru
88697,https://lenta.ru/news/2004/03/03/supertuesday/,"""Супервторник"" в США: в десяти штатах проходят демократические праймериз","Во вторник в десяти американских штатах стартовали первичные выборы, в результате которых должен определиться единый кандидат на кресло президента США от Демократической партии. Праймериз проводятся в штатах Джорджия (Georgia), Вермонт (Vermont), Огайо (Ohio), Мэриленд (Maryland), Массачусетс (Massachusetts), Коннектикут (Connecticut), Миннесота (Minnesota), Нью-Йорк (New York), Род-Айленд (Rhode Island) и Калифорния (California). Лидером гонки демократов остается сенатор от штата Массачусетс Джон Керри (John Kerry), одержавший победу в 18 штатах из 20, где уже проводились праймериз. Керри противостоит сенатор от штата Новая Каролина Джон Эдвардс (John Edwards). Кроме того, в списках для голосования указан и бывший губернатор штата Вермонт Говард Дин (Howard Dean). Хотя 19 февраля он официально отказался от дальнейшего участия в избирательной кампании. К настоящему моменту праймериз завершены в штатах Джорджия, Вермонт и Огайо, сообщается на сайте BBC News. По предварительным данным, победу в Огайо одержал Джон Керри. В то же время, согласно exit polls, в Джорджии лидирует Джон Эдвардс, отмечает CNN. Тем временем в штате Вермонт победа досталась Говарду Дину, уже снявшему свою кандидатуру. Всего в голосовании во всех десяти штатах примет участие 1151 выборщик. Для утверждения кандидата как официального соперника Джорджа Буша на президентских выборах, одному из претендентов необходимо заручиться поддержкой 2162 выборщиков по всей стране. По прогнозам канала CNN, Джон Керри одержит убедительные победы в штатах Мэриленд, Коннектикут, а также в своем родном штате Массачусетс. Предположительно в среду Джон Эдвардс откажется от дальнейшего участия в президентской гонке, цитирует CNN неназванные источники в штабе сенатора от Новой Каролины.",Россия,Все,2004-03-03,ru
88699,https://lenta.ru/news/2004/03/03/fire/,В Москве горит здание Арбитражного суда,"Вечером в среду в Москве загорелось здание Арбитражного суда, сообщает РИА ""Новости"". Сигнал о возгорании в здании суда, расположенного по адресу улица Новобасманная, 10, поступил на пульт пожарной охраны примерно в 21:30. По предварительной информации, площадь возгорания составляет 700 квадратных метров. Пожару присвоена третья категория сложности. Эпицентр возгорания находится на чердаке восьмиэтажного дома, где наблюдается открытое пламя высотой около двух метров. На месте происшествия работают 20 пожарных расчетов, несколько нарядов ГИБДД, спасатели, бригады ""скорой помощи"". Из здания были эвакуированы пять человек. Сведений о пострадавших не поступало.",Россия,Все,2004-03-03,ru
88700,https://lenta.ru/news/2004/03/04/pakistan2/,Пакистан: мы не предлагали Нигерии ядерную бомбу,"Военное командование Пакистана опровергло информацию о том, что Пакистан предложил Нигерии приобрести ядерное оружие. Как сообщалось ранее, накануне нигерийское министерство обороны заявило, что глава пакистанского комитета начальников штабов генерал Мухаммад Азиз Хан (Muhammad Aziz Khan) во время двусторонних переговоров в Лагосе предложил Нигерии ""усилить военную мощь"" путем приобретения у Пакистана ядерных бомб. Как передает France-Presse, представитель пакистанского военного ведомства выступил с заявлением, в котором назвал эту информацию ""безосновательной"" и сообщил, что Азиз Хан подобных разговоров в нигерийской столице не вел. В конце января года Нигерия заявляла о подготовке предварительного договора с Северной Кореей, по условиям которого Нигерия должна получить ракетные технологии КНДР - впоследствии это сообщение опровергли в Пхеньяне, а пресс-секретать президента Нигерии заявил, что никаких соглашений пока не подписано. Тогда было также заявлено, что Нигерия не пытается получить оружие массового поражения, а ракеты планирует использовать исключительно для защиты собственной территории. В Пакистане, как известно, продолжается расследование деятельности Абдул-Кадир Хана (Abdul Qadeer Khan) - ""отца ядерной программы"" страны, - который признался в том, что тайно торговал созданными при его участии ядерными технологиями. Хан был смещен с занимаемого поста и задержан, однако впоследствии помилован указом президента Мушаррафа.",Мир,Все,2004-03-04,ru
88711,https://lenta.ru/news/2004/03/04/haiti1/,На родине культа вуду введено чрезвычайное положение,"В карибском островном государстве Гаити введено чрезвычайное положение, сообщает агентство AFP. Об этом объявил в среду премьер-министр страны Ивон Нептун. Причиной этого решения стали непрекращающиеся вооруженные столкновения между сторонниками бывшего президента Аристида и повстанцами. Нептун заявил, что ущерб от вандализма и мародерства уже достиг отметки в 300 миллионов долларов. Премьер-министр также объявил о создании комиссии, которая будет координировать вопросы национальной безопасности, пока не будет сформировано новое правительство Гаити. Напомним, что беспорядки на Гаити начались в первых числах февраля, когда противники Аристида захватили контроль над городом Гонаив. Вскоре жители еще 10 городов на севере и западе страны присоединились к мятежникам и двинулись к столице Гаити городу Порт-о-Пренсу. В результате столкновений между сторонниками и противниками правительственного режима погибли около 100 человек. В воскресенье Аристид бежал из Гаити, отправившись в Центрально-Африканскую Республику. После этого на остров были введены американские и французские миротворцы. В среду на остров прибыла первая часть чилийского воинского контингента. Тем временем, командир американских морских пехотинцев договорился с лидером повстанцев Ги Филиппом о разоружение незаконных вооруженных формирований в обмен на гарантии безопасности. Республика Гаити занимает западную часть одноименного острова. На востоке она граничит с Доминиканской республикой, а на западе неширокий пролив отделяет ее от Кубы. Гаити является одной из самых бедных стран мира. Основную часть населения составляют потомки негров-рабов, вывезенных из Африки для работы на плантациях. Мулаты, среди предков которых были французские колонисты, составляют меньшинство, но занимают ведущие позиции в бизнесе и политике. Между двумя этническими группами продолжают сохранятся напряженные отношения.",Мир,Все,2004-03-04,ru
88713,https://lenta.ru/news/2004/03/04/imf/,Глава МВФ получил шанс стать президентом Германии,"Глава Международного валютного фонда Херст Келер (Horst Koehler) был выдвинут кандидатом в президенты Германии от правоцентристского альянса, в который входят Свободная демократическая партия (Freie Demokratische Partei - СвДП) и Христианский союз. По информации сайта BBC News, сам исполнительный директор МВФ пока не давал своего согласия, но депутат СвДП Вольфганг Герхардт (Wolfgang Gerhardt) уже решился на такие слова: ""Смею предположить, что следующим президентом будет назван доктор Келер"". Двухпартийный альянс контролируют специальную ассамблею, которой 23 мая предстоит выбрать нового президента страны. Нынешний президент социал-демократ Йоханнес Рау, проработавший на своем по большей части церемониальном посту пять лет, не собирается за него бороться. Правящая коалиция социал-демократов и Зеленых предложила свою кандидатуру - ректора Университета Виадрина Гезину Шван (Gesine Schwan). В случае избрания она станет первой женщиной президентом за всю историю Германии. Ее конкурент 61-летний Херст Келер во времена Гельмута Коля более 10 лет проработал в Министерстве финансов Германии и способствовал продвижению евро как единой валюты ЕС. До своего прихода в МВФ он возглавлял Европейский банк реконструкции и развития.",Мир,Все,2004-03-04,ru
88718,https://lenta.ru/news/2004/03/04/retrial/,Немецкий суд пересмотрит дело осужденного гамбургского аль-каедовца,"Федеральный суд в Гамбурге принял положительное решение по апелляции адвокатов марокканца Мунира аль-Мотассадека (Mounir al-Motassadek) - единственного человека, отбывающего наказание по обвинению в причастности к терактам 11 сентября 2001 года в США, сообщает CNN. В январе прошлого года аль-Мотассадек, 29-летний студент Гамбургского университета, был приговорен к 15 годам тюремного заключения за причастность к деятельности гамбургской ячейки организации ""Аль-Каеда"". Считается, что эта ячейка подготовила трех смертников, направивших в день терактов самолеты на объекты в Нью-Йорке и Вашингтоне. Однако адвокаты утверждают, что в их распоряжении имеются доказательства невиновности аль-Мотассадека, которые не удается представить из-за того, что спецслужбы США держат в секрете ключевую информацию и не позволяют допрашивать нужных адвокатам свидетелей. Федеральный суд выслушал в четверг аргументы защиты отправил дело на повторное рассмотрение в суд низшей инстанции. Вместе с тем, судья Клаус Толксдорф (Klaus Tolksdorf) отметил, что не считает Мотассадека полностью невиновным, он лишь предполагает, что тот получил неадекватное наказание. В феврале этого года немецким судом был оправдан Абдельхани Мзуди, студент, также ранее обвинявшийся в причастности к деятельности ячейки ""Аль-Каеды"". Его адвокатам удалось убедить суд, что он был просто знаком с предполагаемыми террористами, но участия в их деятельности не принимал.",Россия,Все,2004-03-04,ru
88720,https://lenta.ru/news/2004/03/04/discharge/,Виктор Христенко уволил председателя РФФИ,"Руководитель Российского фонда федерального имущества (РФФИ) Владимир Малин отстранен от занимаемой должности распоряжением исполняющего обязанности премьер-министра Виктора Христенко, передает РИА ""Новости"". На освободившийся пост временно утвержден первый зампред РФФИ Кирилл Томащук. В департаменте правительственной информации по поводу решения Христенко заявили: ""Малин отстранен в соответствии с Трудовым кодексом Российской Федерации"". В конце февраля в рамках уголовного дела о хищении 20 процентов акций АО ""Апатит"" руководителю РФФИ было предъявлено обвинение в превышении служебных полномочий с причинением тяжких последствий, после чего Малин был временно отстранен со своей должности. По этому же делу ранее были обвинены экс-глава ""ЮКОСа"" Михаил Ходорковский и председатель совета директоров МФО ""МЕНАТЕП"" Платон Лебедев. По версии Генпрокуратуры при заключении мирового соглашения с ЗАО ""Волна"", участвовавшего в конкурсе на приобретение государственного пакета акций ""Апатита"", работники РФФИ допустили серьезные злоупотребления.",Россия,Все,2004-03-04,ru
